{
  "schemaVersion": 1,
  "transactionId": "94311074-c09b-45f6-8512-1fb4d9a887a0",
  "workItem": "POC-002",
  "project": "app",
  "sessionId": "84318dc8-23f8-4dfa-9963-9ff9f286f439",
  "snapshotHash": "16d0c4c6d0bd97fe3c7ae4cd279b8239f4f9b6ee3e13e22918f8c7be22849c30",
  "confirmationHash": "992d2464696e41c76e80f7887afa8d8ee5a3c08dfea108adccc60fdb84ac3a3f",
  "targetRoot": "D:\\Testing projects\\workflow test\\testing-workflow",
  "changeHash": "3e0aeb6b350b69286f3999e8dc757814d191685237c35b48260ebf2147cddaf0",
  "noChange": false,
  "appliedAt": "2026-09-25T09:59:18.395Z"
}
